{
  "schema_version": "1.0.0",
  "task_id": "task-001",
  "created_at": "2026-08-05T08:03:04.000+08:00",
  "status": "not_requested",
  "model_snapshot_ref": null,
  "input": null,
  "calls": [],
  "staging": [],
  "findings": [],
  "application_results": [],
  "skip_reason": null,
  "warnings": [],
  "errors": []
}
